UniqueName,Name,Category,isRepeating,ProbabilityBoost,ToolDescription,StorageCapacity
player_ultimate,Player Ultimate,All,True,1,The ultimate tool THE PLAYER HIMSELF used for everything.,
mining_pickaxe,Pickaxe,Mining,True,1,The classic mining tool-used for many things.,
mining_furnace,Furnace,Mining,False,1,Used to smelt ores into metals.,
mining_oil_extractor,Oil Extractor,Mining,True,1,Used to extract oil from the ground.,400
mining_oil_silo,Oil Silo,Mining,False,1,Used to store oil.,1000
mining_drill,Drill,Mining,True,1,Used to drill into the ground.,
mining_excavator,Excavator,Mining,True,1,Used to excavate the ground.,
farming_rake,Rake,Farming,True,1,Used to rake the ground.,
woodcutting_axe,Axe,Woodcutting,False,1,Used to cut trees.,